id,name,name_en,scientific_name,is_active,description_ru,description_ua,description_en,symptoms_ru,symptoms_ua,symptoms_en,development_conditions_ru,development_conditions_ua,development_conditions_en,control_measures_ru,control_measures_ua,control_measures_en,photo_path,source_urls,crops
f1204d6d-7a47-4901-bf73-952c943c78bc,Плесневение початков,Mold development on cobs,,True,"Возбудители -Penicillium, Aspergillus, Mucor, Botrytis, Cladosporium, Cephalosporium, Trichotheciumи др.","Збудники - Penicillium, Aspergillus, Mucor, Botrytis, Cladosporium, Cephalosporium, Trichothecium та інші.","Pathogens include Penicillium, Aspergillus, Mucor, Botrytis, Cladosporium, Cephalosporium, Trichothecium, and others.","Симптомы болезниПоражаются початки в поле, при хранении и после высева. В результате растение теряет энергию роста, снижается всхожесть, появляется изреженность посева.На поверхности зерновки формируется  голубой, белый, серо-зеленый, оливково-черный или розовый налет гриба.","Симптоми хвороби Вражаються качани в полі, під час зберігання та після висіву. В результаті рослина втрачає енергію росту, знижується схожість, з'являється зрідженість посіву. На поверхні зернівки формується блакитний, білий, сіро-зелений, оливково-чорний або рожевий наліт гриба.","Symptoms of the disease affect the ears in the field, during storage, and after sowing. As a result, the plant loses growth vigor, germination decreases, and stand thinning occurs. A blue, white, gray-green, olive-black, or pink fungal coating forms on the surface of the grain.","Факторы, содействующие развитию болезниГрибы начинают заселение зерновок во влажной почве при 7-10°СНеправильное хранение семянРанние сроки севаНизкое качество семенного материала.","Фактори, що сприяють розвитку хворобиГриби починають заселення зернівок у вологому ґрунті при 7-10°СНеправильне зберігання насінняРанні строки сівбиНизька якість насіннєвого матеріалу.",Factors Contributing to Disease Development Fungi begin colonizing grains in moist soil at 7-10°C Improper seed storage Early sowing dates Low quality of seed material.,Меры защитыОптимальные сроки севаСоблюдение режима храненияПротравливание семян,Заходи захистуОптимальні строки сівбиДотримання режиму зберіганняПротруювання насіння,Protection measuresOptimal sowing datesAdherence to storage conditionsSeed treatment,downloads\images/diseases\disease_Плесневение_початков_f1204d6d-7a47-4901-bf73-952c943c78bc.jpg,https://betaren.ru/harmful/bolezni/bolezni-kukuruzy/plesnevenie_pochatkov/,кукуруза
71d68e31-ce0d-4b4d-978d-be20b26f1d3e,Пузырчатая головня кукурузы,Corn smut,базидиальный гриб,True,Возбудитель - базидиальный грибUstilago zeae Ungerиз порядкаUstilaginales.,Збудник - базидіальний гриб Ustilago zeae Unger з порядку Ustilaginales.,The pathogen is the basidiomycete fungus *Ustilago zeae* Unger from the order *Ustilaginales*.,"Симптомы болезниПроявляется в виде пузыревидных вздутий различной величины до 15 см и более на всех частях растения, кроме корней. Развитие начинается с бледного припухшего пятнышка, которое разрастается и превращается в большое, заполненное сначала белой мякотью, а позже сероватой или розоватой слизистой массой, превращающейся далее в темно-оливковую пылящую массу спор. Наибольших размеров вздутия достигают на стеблях и початках. На листьях вздутия меньше, в виде шероховатых морщин, которые подсыхают до образования спор.Сильное поражение может наблюдаться на всходах, когда поражается верхушечная почка. Зараженные ткани почки превращаются в головневые наросты и разрастаются так, что в несколько раз превышают свой первоначальный объем. В результате создается впечатление о «диффузном» поражении растения.Самая тяжелая форма болезни - поражение стебля: растение искривляется, часть стебля выше пораженного места превращается в головневые наросты и отмирает.Образование галлов происходит в течение примерно двух недель. Созревшие в галлах споры способны прорастать и заражать растения в течение всего вегетационного периода. Осенью при уборке кукурузы головневые вздутия отламываются и могут зимовать на кукурузном поле. Весной, перезимовавшие споры вновь заражают кукурузу. Наиболее высокая восприимчивость кукурузы к болезни наблюдается в период от выбрасывания метелок до молочной спелости.Источник инфекции:грибница распадается на огромное количество телиоспор, которые являются источником заражения молодых растущих органов растения. Телиоспоры сохраняются в почве до 3 лет.","Симптоми хвороби проявляються у вигляді пухирчастих здуттів різного розміру до 15 см і більше на всіх частинах рослини, окрім коренів. Розвиток починається з блідого припухлого плямки, яке розростається і перетворюється на велике, заповнене спочатку білою м'якоттю, а пізніше сіруватою або рожевуватою слизовою масою, яка далі перетворюється на темно-оливкову порошкоподібну масу спор. Найбільших розмірів здуття досягають на стеблах і качанах. На листках здуття менші, у вигляді шорстких зморшок, які підсихають до утворення спор. Сильне ураження може спостерігатися на сходах, коли уражується верхівкова брунька. Уражені тканини бруньки перетворюються на головневі нарости і розростаються так, що в кілька разів перевищують свій початковий обсяг. У результаті створюється враження про «дифузне» ураження рослини. Найважча форма хвороби - ураження стебла: рослина викривляється, частина стебла вище ураженого місця перетворюється на головневі нарости і відмирає. Утворення галлів відбувається протягом приблизно двох тижнів. Дозрілі в галлах спори здатні проростати і заражати рослини протягом усього вегетаційного періоду. Восени під час збирання кукурудзи головневі здуття обламуються і можуть зимувати на кукурудзяному полі. Навесні, перезимовані спори знову заражають кукурудзу. Найвища сприйнятливість кукурудзи до хвороби спостерігається в період від викидання волоті до молочної стиглості. Джерело інфекції: грибниця розпадається на величезну кількість теліоспор, які є джерелом зараження молодих зростаючих органів рослини. Теліоспори зберігаються в ґрунті до 3 років.","Symptoms of the Disease

The disease manifests as blister-like swellings of various sizes, up to 15 cm or more, on all parts of the plant except the roots. The development begins with a pale, swollen spot that expands and transforms into a large mass, initially filled with white pulp, which later becomes a grayish or pinkish mucilaginous mass, eventually turning into a dark olive, dusty mass of spores. The swellings reach their largest size on the stems and ears. On the leaves, the swellings are smaller, appearing as rough wrinkles that dry out until spore formation. Severe infection can be observed in seedlings when the apical bud is affected. The infected tissues of the bud transform into smut galls and expand to several times their original volume, creating an impression of ""diffuse"" infection of the plant.

The most severe form of the disease is stem infection: the plant becomes distorted, and the part of the stem above the infected area turns into smut galls and dies. Gall formation occurs over approximately two weeks. The spores matured in the galls can germinate and infect plants throughout the entire growing season. In the fall, during corn harvesting, the smut swellings break off and can overwinter in the cornfield. In spring, the overwintered spores infect corn again. The highest susceptibility of corn to the disease is observed from the tasseling stage to the milk stage.

Source of Infection:

The mycelium disintegrates into a vast number of teliospores, which serve as the source of infection for the young growing organs of the plant. Teliospores can persist in the soil for up to 3 years.","Факторы, содействующие развитию болезниПовышенная температура воздухаНеравномерные осадкиТакже загущенный посев","Фактори, що сприяють розвитку хворобиПідвищена температура повітряНерівномірні опадиТакож загущений посів","Factors Contributing to Disease Development Elevated Air Temperature Uneven Precipitation Also, Dense Planting",Меры защитыУдаление с полей послеуборочных остатков кукурузыИспользование устойчивых и толерантных гибридовПротравливание семянФунгицидная обработка,Заходи захистуВидалення з полів післяжнивних залишків кукурудзиВикористання стійких і толерантних гібридівПротруювання насінняФунгіцидна обробка,"Protective Measures

- Removal of post-harvest corn residues from fields
- Use of resistant and tolerant hybrids
- Seed treatment
- Fungicide application",downloads\images/diseases\disease_Пузырчатая_головня_кукурузы_71d68e31-ce0d-4b4d-978d-be20b26f1d3e.jpg,https://betaren.ru/harmful/bolezni/bolezni-kukuruzy/puzirchataya_golovnya/,кукуруза
c8120d5e-c319-49d7-bc55-18bbcf5f9a36,Пыльная головня кукурузы,Corn smut,,True,Возбудитель болезни - базидиальный грибSorosporium reilianum McApl. f. zeae Gescheleиз порядкаUstilaginales,Збудник хвороби - базидіальний гриб Sorosporium reilianum McApl. f. zeae Geschele з порядку Ustilaginales.,The pathogen of the disease is the basidiomycete fungus Sorosporium reilianum McApl. f. zeae Geschele from the order Ustilaginales.,"Симптомы болезниПоражаются только метелки и початки. Метелки превращаются в пылящую черную массу. Вместо початка образуется овально-конусовидный ком волокон и спор гриба. К моменту наступления молочной спелости обертки желвака высыхают и раскрываются. Споры распыляются медленно, они удерживаются остатками волокон початка вплоть до созревания кукурузы. Больные растения отстают в росте, при этом листья сильно разрастаются, наблюдается фасциация.Источник инфекции:телиоспоры гриба сохраняются долгое время в почве и на зерновках.","Симптоми хвороби Уражаються лише волоті та качани. Волоті перетворюються на пилючу чорну масу. Замість качана утворюється овально-конусоподібний клубок волокон і спор гриба. До моменту настання молочної стиглості обгортки клубка висихають і розкриваються. Спори розпилюються повільно, вони утримуються залишками волокон качана аж до дозрівання кукурудзи. Хворі рослини відстають у рості, при цьому листя сильно розростається, спостерігається фасціація. Джерело інфекції: теліоспори гриба зберігаються тривалий час у ґрунті та на зернівках.","Symptoms of the Disease

Only tassels and ears are affected. Tassels transform into a dusty black mass. Instead of an ear, an oval-conical mass of fibers and fungal spores forms. By the time the milk stage of maturity is reached, the husks of the gall dry out and open. The spores disperse slowly, remaining attached to the remnants of the ear fibers until the corn matures. Infected plants lag in growth, with significant leaf proliferation and fasciation observed.

Source of Infection:

The teliospores of the fungus persist for a long time in the soil and on the grains.","Факторы, содействующие развитию болезниТемпература 28-30 °СУмеренная влажность","Фактори, що сприяють розвитку хворобиТемпература 28-30 °СПомірна вологість",Factors Contributing to Disease DevelopmentTemperature 28-30 °CModerate Humidity,Меры защитыСевооборот. Рекомендуется возвращать кукурузу не ранее 3–4 летУдаление с полей послеуборочных остатков кукурузыПроводить посев кукурузы в оптимальные срокиИспользовать толерантные гибриды.Протравливание семян частично освобождает растения от болезни.,Заходи захистуСівозміна. Рекомендується повертати кукурудзу не раніше ніж через 3–4 рокиВидалення з полів післяжнивних залишків кукурудзиПроводити посів кукурудзи в оптимальні строкиВикористовувати толерантні гібриди.Протруювання насіння частково звільняє рослини від хвороби.,Protection MeasuresCrop Rotation. It is recommended to return corn to the same field no earlier than every 3–4 years.Removal of post-harvest corn residues from the fields.Sowing corn at optimal times.Use of tolerant hybrids.Seed treatment partially frees plants from disease.,downloads\images/diseases\disease_Пыльная_головня_кукурузы_c8120d5e-c319-49d7-bc55-18bbcf5f9a36.jpg,https://betaren.ru/harmful/bolezni/bolezni-kukuruzy/pilnaya_golovnya_kukuruzi/,кукуруза
