id,name,name_en,scientific_name,is_active,description_ru,description_ua,description_en,symptoms_ru,symptoms_ua,symptoms_en,development_conditions_ru,development_conditions_ua,development_conditions_en,control_measures_ru,control_measures_ua,control_measures_en,photo_path,source_urls,crops
e883610f-5971-4527-9188-640b9b53d171,Крапчатость семядолей льна,Mottling of flax cotyledons,,True,Возбудитель - несовершенный грибFungus sterilis Winogr,Збудник - недосконалий гриб Fungus sterilis Winogr,Pathogen - imperfect fungus Fungus sterilis Winogr,"Симптомы болезниПроявляется в начале прорастания семян и появления всходов.На семядолях, подсемядольном колене и корешках проростков появляются мелкоточечная пятнистость и штрихи красно-коричневого цвета. При сильном развитии болезни пятнышки сливаются в сплошное пятно, семядоли становятся прозрачными и загнивают, вокруг поражений появляется грязно-белый паутинистый налет. Сильно пораженные проростки часто погибают до появления всходов льна на поверхности почвы.Семена льна заражаются при уборке урожая в дождливую погоду. Гриб сильнее развивается в семенах, имеющих повышенную влажность. Зараженностьих обнаруживается при биологическом анализе.Вредоносность болезни заключается в изреживании посевов и снижении урожая льна.Развитие болезни обычно связано с запозданием уборки льна, наступлением осенних дождей, длительной сушкой снопов в поле, приводящей к частичному прорастанию семян, а также повышенной их влажности.Такие семена необходимо при засыпке подсушить и организовать систематическое за ними наблюдение.","Симптоми хвороби проявляються на початку проростання насіння та появи сходів. На сім'ядолях, підсім'ядольному коліні та корінцях проростків з'являються дрібнокрапкові плями та штрихи червоно-коричневого кольору. При сильному розвитку хвороби плями зливаються в суцільну пляму, сім'ядолі стають прозорими і загнивають, навколо уражень з'являється брудно-білий павутинний наліт. Сильно уражені проростки часто гинуть до появи сходів льону на поверхні ґрунту. Насіння льону заражається під час збирання врожаю в дощову погоду. Гриб сильніше розвивається в насінні, яке має підвищену вологість. Зараженість виявляється при біологічному аналізі. Шкідливість хвороби полягає в зрідженні посівів та зниженні врожаю льону. Розвиток хвороби зазвичай пов'язаний із запізненням збирання льону, настанням осінніх дощів, тривалим сушінням снопів у полі, що призводить до часткового проростання насіння, а також підвищеної їх вологості. Таке насіння необхідно при засипці підсушити та організувати систематичне спостереження за ним.","Symptoms of the Disease

The disease manifests at the beginning of seed germination and seedling emergence. On the cotyledons, hypocotyl, and roots of the seedlings, small red-brown spots and streaks appear. With severe disease development, the spots merge into a continuous blotch, the cotyledons become translucent and rot, and a dirty-white web-like coating appears around the lesions. Severely affected seedlings often die before the flax sprouts emerge on the soil surface. Flax seeds become infected during harvest in rainy weather. The fungus develops more intensely in seeds with increased moisture content. Infection is detected through biological analysis.

The harmfulness of the disease lies in the thinning of crops and the reduction of flax yield. The development of the disease is usually associated with delayed flax harvesting, the onset of autumn rains, prolonged drying of sheaves in the field leading to partial seed germination, and increased seed moisture. Such seeds need to be dried during storage and systematically monitored.","Факторы, содействующие развитию болезниВлажная погода","Фактори, що сприяють розвитку хворобиВолога погода",Factors Contributing to Disease Development: Humid Weather,Меры защитыИспользование качественного посевного материалаПротравливание семян,Заходи захистуВикористання якісного посівного матеріалуПротруювання насіння,"Protection Measures

Use of Quality Seed Material

Seed Dressing",downloads\images/diseases\disease_Крапчатость_семядолей_льна_e883610f-5971-4527-9188-640b9b53d171.jpg,https://betaren.ru/harmful/bolezni/bolezni-lna/krapchatost/,лен
dd33f491-90ef-43ea-908d-0f2e9fb5cc2c,Мучнистая роса льна,Powdery mildew of flax,,True,Возбудитель -Erysiphe cichoracearum DC. f. lini Jacz.,Збудник - Erysiphe cichoracearum DC. f. lini Jacz.,Pathogen - Erysiphe cichoracearum DC. f. lini Jacz.,"Симптомы болезниХарактеризуется появлением на листьях и стеблях сначала белого, а затем мучнистого налета. Через некоторое время налет уплотняется, и в нем в виде черных точек появляются клейстотеции гриба. При сильном поражении листья преждевременно желтеют и отмирают.В период вегетации гриб распространяется конидиями, образующимися на грибнице в виде цепочек. Клейстотеции черные, шаровидные, их придатки почти не отличаются от грибницы. В одном клейстотеции образуется 10-15 сумок, а в каждой сумке - по две-четыре сумкоспоры. Сумки бесцветные, яйцевидные или эллиптические, размером 58-90×30-50 мкм.Зимует гриб на остатках растений в виде клейстотециев, в которых весной созревают сумки и сумкоспоры. От них и происходит первичное заражение растений.Вредоносность болезни заключается в уменьшении урожая волокна и семян.","Симптоми хвороби характеризуються появою на листках і стеблах спочатку білого, а потім борошнистого нальоту. Через деякий час наліт ущільнюється, і в ньому у вигляді чорних точок з'являються клейстотеції гриба. При сильному ураженні листя передчасно жовтіє і відмирає. У період вегетації гриб поширюється конідіями, що утворюються на грибниці у вигляді ланцюжків. Клейстотеції чорні, кулясті, їх придатки майже не відрізняються від грибниці. В одному клейстотеції утворюється 10-15 сумок, а в кожній сумці - по дві-чотири сумкоспори. Сумки безбарвні, яйцеподібні або еліптичні, розміром 58-90×30-50 мкм. Зимує гриб на залишках рослин у вигляді клейстотеціїв, у яких навесні дозрівають сумки і сумкоспори. Від них і відбувається первинне зараження рослин. Шкідливість хвороби полягає у зменшенні врожаю волокна і насіння.","Symptoms of the Disease

The disease is characterized by the appearance of a white, and later powdery, coating on the leaves and stems. Over time, this coating becomes denser, and cleistothecia of the fungus appear as black dots within it. In cases of severe infection, the leaves prematurely yellow and die. During the growing season, the fungus spreads through conidia, which form on the mycelium in chains. The cleistothecia are black and spherical, with appendages that are almost indistinguishable from the mycelium. Each cleistothecium contains 10-15 asci, and each ascus holds two to four ascospores. The asci are colorless, ovoid or elliptical, measuring 58-90×30-50 µm. The fungus overwinters on plant debris in the form of cleistothecia, where asci and ascospores mature in the spring. This leads to the primary infection of plants. 

The harmfulness of the disease lies in the reduction of fiber and seed yield.",,,,,,,downloads\images/diseases\disease_Мучнистая_роса_льна_dd33f491-90ef-43ea-908d-0f2e9fb5cc2c.jpg,https://betaren.ru/harmful/bolezni/bolezni-lna/muchnistaya_rosa_lna/,лен
bf21e81e-413f-4325-802e-e070cab8b92e,Пасмо льна,Flax wilt,несовершенный гриб,True,Возбудитель - несовершенный грибSeptoria linicola (Speg.)Карантинный объект.,Збудник - недосконалий гриб Septoria linicola (Speg.). Карантинний об'єкт.,"The pathogen is an imperfect fungus, Septoria linicola (Speg.), a quarantine pest.","Симптомы болезниНа растениях льна первые признаки заболевания появляются на всходах или в фазе «елочки» в виде коричневых пятен на семядолях. Пятно довольно быстро охватывает семядольный листочек, который становится коричневым, подсыхает, покрывается большим количеством темных точек (пикнид) и опадает. В дальнейшем эти пятна появляются и на настоящих листьях. Пятна постепенно в центре светлеют, и на них появляются темные точки пикнид, которые располагаются концентрически. Пораженные листья постепенно засыхают и опадают, оголяя стебель снизу, а болезнь переходит на верхние листья.Затем пасмо поражает и стебель. Пятна на стебле также имеют коричневую окраску. Он в связи с этим приобретает пестрый вид - коричневые и зеленые участки чередуются. В центре пятна начинают светлеть и на них появляются темные пикниды. Позднее пятна на стебле сливаются, цвет стебля становится коричнево-серым, и он сплошь покрывается массой пикнид. Пораженные растения делаются как бы лохматыми от обрывков лубяных волокон. При сильном поражении все поле приобретает сероватый оттенок. Заболевание переходит на бутоны, которые засыхают, покрываются пикнидами и опадают. Пораженные молодые коробочки также засыхают и опадают. Вполне сформированные коробочки в случае их поражения дают нормально развитые семена, хотя и зараженные болезнью.Источник инфекции:главным образом семена, а также пикниды и пикноспоры на растительных остатках, где гриб может сохраняться до 7 лет. Пикноспоры в период вегетации распространяются ветром, капельками дождя и насекомыми. Прорастая, они образуют инфекционные гифы, которые и проникают в ткани растений.Вредоносность:пораженные посевы могут погибнуть или дать очень низкий урожай.","Симптоми хворобиНа рослинах льону перші ознаки захворювання з'являються на сходах або у фазі «ялинки» у вигляді коричневих плям на сім'ядолях. Пляма досить швидко охоплює сім'ядольний листочок, який стає коричневим, підсихає, вкривається великою кількістю темних точок (пікнід) і опадає. Надалі ці плями з'являються і на справжніх листках. Плями поступово в центрі світлішають, і на них з'являються темні точки пікнід, які розташовуються концентрично. Уражені листки поступово засихають і опадають, оголюючи стебло знизу, а хвороба переходить на верхні листки. Потім пасмо уражає і стебло. Плями на стеблі також мають коричневе забарвлення. Він у зв'язку з цим набуває строкатого вигляду - коричневі і зелені ділянки чергуються. У центрі плями починають світлішати і на них з'являються темні пікніди. Пізніше плями на стеблі зливаються, колір стебла стає коричнево-сірим, і він повністю вкривається масою пікнід. Уражені рослини стають ніби кошлатими від обривків луб'яних волокон. При сильному ураженні все поле набуває сіруватого відтінку. Захворювання переходить на бутони, які засихають, вкриваються пікнідами і опадають. Уражені молоді коробочки також засихають і опадають. Повністю сформовані коробочки у разі їх ураження дають нормально розвинене насіння, хоча і заражене хворобою.Джерело інфекції:головним чином насіння, а також пікніди і пікноспори на рослинних рештках, де гриб може зберігатися до 7 років. Пікноспори в період вегетації поширюються вітром, краплями дощу та комахами. Проростаючи, вони утворюють інфекційні гіфи, які проникають у тканини рослин.Шкідливість:уражені посіви можуть загинути або дати дуже низький урожай.","Symptoms of the Disease

In flax plants, the first signs of the disease appear on seedlings or in the ""Christmas tree"" phase as brown spots on the cotyledons. The spot quickly covers the cotyledon leaf, which turns brown, dries up, becomes covered with numerous dark dots (pycnidia), and falls off. Subsequently, these spots also appear on the true leaves. The spots gradually lighten in the center, and dark pycnidia dots appear, arranged concentrically. Affected leaves gradually dry up and fall off, exposing the stem from below, and the disease progresses to the upper leaves.

The disease then affects the stem. The spots on the stem are also brown. As a result, the stem acquires a mottled appearance with alternating brown and green areas. The center of the spots begins to lighten, and dark pycnidia appear. Later, the spots on the stem merge, the stem color becomes brown-gray, and it becomes entirely covered with a mass of pycnidia. Affected plants appear shaggy due to fragments of bast fibers. In severe cases, the entire field takes on a grayish tint. The disease spreads to the buds, which dry up, become covered with pycnidia, and fall off. Affected young capsules also dry up and fall off. Fully formed capsules, if affected, produce normally developed seeds, although they are infected with the disease.

Source of Infection:

Primarily seeds, as well as pycnidia and pycnospores on plant debris, where the fungus can persist for up to 7 years. During the growing season, pycnospores spread by wind, raindrops, and insects. Upon germination, they form infectious hyphae that penetrate plant tissues.

Harmfulness:

Affected crops may perish or yield a very low harvest.","Факторы, содействующие развитию болезниРастения сильнее поражаются в сырых местах и низинах при сравнительно высокой температуре воздуха (около 21°C).Заболевание чаще всего встречается очагами, но при благоприятных для него условиях может распространяться по всему полю.","Фактори, що сприяють розвитку хвороби. Рослини сильніше уражуються у вологих місцях і низинах за відносно високої температури повітря (близько 21°C). Захворювання найчастіше зустрічається осередками, але за сприятливих для нього умов може поширюватися по всьому полю.","Factors Contributing to Disease Development

Plants are more severely affected in damp areas and lowlands at relatively high air temperatures (around 21°C). The disease most often occurs in patches, but under favorable conditions, it can spread across the entire field.",,,,downloads\images/diseases\disease_Пасмо_льна_bf21e81e-413f-4325-802e-e070cab8b92e.jpg,https://betaren.ru/harmful/bolezni/bolezni-lna/pasmo/,лен
