id,name,name_en,scientific_name,is_active,description_ru,description_ua,description_en,symptoms_ru,symptoms_ua,symptoms_en,development_conditions_ru,development_conditions_ua,development_conditions_en,control_measures_ru,control_measures_ua,control_measures_en,photo_path,source_urls,crops
a8c8299c-6813-4527-a8e3-e07b12133e07,Антракноз льна,Anthracnose of flax,несовершенный гриб,True,Возбудитель - несовершенный грибColletotrichum lini Boll,Збудник - недосконалий гриб Colletotrichum lini Boll.,Pathogen - the imperfect fungus Colletotrichum lini Boll.,"Симптомы болезниРаспространен повсеместно. Проявляется во все периоды роста и развития растений. На корешках проростков появляются желто-оранжевые или стекловидные серые пятна, которые через некоторое время превращаются в язвы и перетяжки. На подсемядольном колене и семядолях образуются резко ограниченные, сначала желтые или слегка светло-желтые, а затем расплывчатые бурые пятна.Болезнь всходов проявляется и на семядольных листьях в виде резко окаймленных вдавленных светлых пятен. В дальнейшем семядольные листочки буреют и отмирают. Погибшие от антракноза семядольные листья имеют более светлую окраску, чем погибшие от полиспороза.Всходы, у которых поражены корешки и семядоли, обычно погибают. Менее пораженные растения развивают дополнительные корни, но отстают в росте, вследствие чего наблюдается их разноярусность.С ростом льна болезнь обнаруживается на листьях. Здесь, как и на семядолях, появляются сперва желтые, а затем бурые пятна. Пораженные листья засыхают и опадают.В фазе ранней желтой спелости льна болезнь проявляется в нижней части стебля в виде мелких бурых или продолговатых пятен (расплывчатой буроватой мраморности), вследствие чего эту болезнь часто называют мраморной пятнистостью. Иногда антракнозные пятна распространяются по всему стеблю, боковым веточкам и коробочкам. Пораженные коробочки буреют, семена в них образуются щуплые, с низкой всхожестью.В тех случаях, когда гифы гриба разрастаются в семенах льна до образования пигментного слоя, они проникают глубоко в зародыш и вызывают его гибель. После образования в семенах пигментного слоя грибница разрастается только в верхнем ослизняющемся слое оболочки. Такие семена могут прорастать, но грибница из их оболочек переходит на молодой росток и поражает корневую шейку или семядоли всходов.Источник инфекции:зараженные семена, в которых гриб может сохраняться до восьми лет; в почве гриб сохраняется в виде спор и грибницы.В период вегетации растений болезнь распространяется конидиями, которые разносятся ветром, дождем и насекомыми.Вредоносностьболезни заключается в уменьшении всхожести семян, изреживании всходов и многоярусности. Солома сильно пораженных растений более легкая и ломкая, а качество волокна низкое.","Симптоми хвороби Поширена повсюдно. Проявляється у всі періоди росту та розвитку рослин. На корінцях проростків з'являються жовто-оранжеві або склоподібні сірі плями, які згодом перетворюються на виразки та перетяжки. На підсім'ядольному коліні та сім'ядолях утворюються різко обмежені, спочатку жовті або злегка світло-жовті, а потім розпливчасті бурі плями. Хвороба сходів проявляється і на сім'ядольних листках у вигляді різко окреслених вдавлених світлих плям. Надалі сім'ядольні листочки буріють і відмирають. Загиблі від антракнозу сім'ядольні листки мають світліше забарвлення, ніж загиблі від полісфорозу. Сходи, у яких уражені корінці та сім'ядолі, зазвичай гинуть. Менш уражені рослини розвивають додаткові корені, але відстають у рості, внаслідок чого спостерігається їх багатоярусність. З ростом льону хвороба виявляється на листках. Тут, як і на сім'ядолях, з'являються спочатку жовті, а потім бурі плями. Уражені листки засихають і опадають. У фазі ранньої жовтої стиглості льону хвороба проявляється в нижній частині стебла у вигляді дрібних бурих або подовжених плям (розпливчастої буроватої мармуровості), внаслідок чого цю хворобу часто називають мармуровою плямистістю. Іноді антракнозні плями поширюються по всьому стеблу, боковим гілочкам і коробочкам. Уражені коробочки буріють, насіння в них утворюється щупле, з низькою схожістю. У випадках, коли гіфи гриба розростаються в насінні льону до утворення пігментного шару, вони проникають глибоко в зародок і викликають його загибель. Після утворення в насінні пігментного шару грибниця розростається тільки у верхньому ослизнюючому шарі оболонки. Таке насіння може проростати, але грибниця з їх оболонок переходить на молодий паросток і уражає кореневу шийку або сім'ядолі сходів. Джерело інфекції: заражене насіння, в якому гриб може зберігатися до восьми років; у ґрунті гриб зберігається у вигляді спор і грибниці. У період вегетації рослин хвороба поширюється конідіями, які розносяться вітром, дощем та комахами. Шкідливість хвороби полягає у зменшенні схожості насіння, зрідженні сходів та багатоярусності. Солома сильно уражених рослин легша і ламка, а якість волокна низька.","Symptoms of the Disease

This disease is widespread and can manifest during all growth and development stages of plants. On the roots of seedlings, yellow-orange or glassy gray spots appear, which eventually turn into ulcers and constrictions. On the hypocotyl and cotyledons, sharply defined spots initially appear yellow or slightly light yellow, then become diffuse brown spots. The disease in seedlings also manifests on the cotyledon leaves as sharply bordered, depressed light spots. Subsequently, the cotyledon leaves turn brown and die. Cotyledon leaves that die from anthracnose have a lighter color compared to those that die from polysporiasis. Seedlings with affected roots and cotyledons usually perish. Less affected plants develop additional roots but lag in growth, resulting in uneven plant height.

As flax grows, the disease becomes apparent on the leaves. Here, as on the cotyledons, yellow spots first appear, which then turn brown. Affected leaves dry up and fall off. During the early yellow ripeness phase of flax, the disease manifests on the lower part of the stem as small brown or elongated spots (diffuse brownish marbling), which is why this disease is often called marbling spot. Sometimes anthracnose spots spread throughout the stem, lateral branches, and capsules. Affected capsules turn brown, and the seeds inside become shriveled with low germination capacity.

In cases where the fungus hyphae grow in flax seeds up to the formation of a pigment layer, they penetrate deeply into the embryo, causing its death. After the formation of the pigment layer in the seeds, the mycelium grows only in the upper mucilaginous layer of the seed coat. Such seeds may germinate, but the mycelium from their coats transfers to the young sprout, affecting the root collar or cotyledons of the seedlings.

Source of Infection:
Infected seeds, in which the fungus can persist for up to eight years; in the soil, the fungus survives as spores and mycelium. During the vegetation period, the disease spreads through conidia, which are dispersed by wind, rain, and insects.

Harmfulness of the disease lies in reducing seed germination, thinning of seedlings, and uneven plant height. The straw of severely affected plants is lighter and more brittle, and the fiber quality is low.","Факторы, содействующие развитию болезниТеплая и влажная погодаЛегкие кислые почвыПоздние сроки посева","Фактори, що сприяють розвитку хворобиТепла та волога погодаЛегкі кислі ґрунтиПізні строки сівби","Factors Contributing to Disease Development

Warm and humid weather

Light acidic soils

Late sowing dates",Меры защитыСевооборотУничтожение остатков растенийГлубокая зяблевая вспашкаТщательная доработка и сушка семянПодкормка ослабленных всходов азотно-калийными удобрениямиПротравливание семян,Заходи захистуСівозмінаЗнищення залишків рослинГлибока зяблева оранкаРетельне доопрацювання та сушка насінняПідживлення ослаблених сходів азотно-калійними добривамиПротруювання насіння,Protection measuresCrop rotationDestruction of plant residuesDeep fall plowingThorough seed refinement and dryingFertilization of weakened seedlings with nitrogen-potassium fertilizersSeed treatment,downloads\images/diseases\disease_Антракноз_льна_a8c8299c-6813-4527-a8e3-e07b12133e07.jpg,https://betaren.ru/harmful/bolezni/bolezni-lna/antraknos_len/,лен
f00237fc-2a87-4eb8-ad17-f97dc01c94c4,Аскохитоз льна,Ascochyta blight of flax,несовершенный гриб,True,Возбудитель - несовершенный грибAscochyta linicola,Збудник - недосконалий гриб Ascochyta linicola,Causal agent - the imperfect fungus Ascochyta linicola,"Симптомы болезниПроявляется на стеблях и коробочках в виде прозрачных бурых, слегка вдавленных пятен без резких очертаний. В местах пятен со временем появляются коричневые точки - пикниды. Сначала они прикрыты эпидермисом, а после его разрушения обнажаются. Нередко бурые пятна разрастаются и охватывают весь стебель. При поражении корневой шейки растение погибает.Заражению растений и развитию болезни способствует повышенная влажность почвы и воздуха. Гриб проникает в стебель растения обычно до цветения льна. В более поздний период он может заразить растение лишь при наличии механических повреждений или в местах уколов насекомыми.Аскохитоз снижает энергию прорастания и всхожесть семян, приводит к изреживанию посевов и снижению качества волокна.Возбудитель болезни образует на стеблях мелкие черные выпуклые точки - пикниды (вместилища спор), которые хорошо заметны на увядших молодых растениях среди бурых студенисто-прозрачных участков пораженных стеблей. В дальнейшем пораженные участки ссыхаются, обесцвечиваются и черные пикниды на них выступают еще резче. Кора стебля разрушается: лубяные волокна обрываются, растрескиваются (размочаливаются), и растение гибнет. Болезнь со стеблей переходит на коробочки и семена, последние теряют всхожесть.Источник заражения:распространяется болезнь главным образом с семенами, а также с остатками урожая на полях, стлищах, на местах скирдования и обмолота. В период вегетации растений источником заражения посевов льна являются споры-гриба, переносимые с больных на здоровые растения ветром, насекомыми, каплями дождя и росы.","Симптоми хвороби проявляються на стеблах і коробочках у вигляді прозорих бурих, злегка вдавлених плям без різких обрисів. У місцях плям з часом з'являються коричневі точки - пікніди. Спочатку вони прикриті епідермісом, а після його руйнування оголюються. Нерідко бурі плями розростаються і охоплюють весь стебло. При ураженні кореневої шийки рослина гине. Зараженню рослин і розвитку хвороби сприяє підвищена вологість ґрунту і повітря. Гриб проникає в стебло рослини зазвичай до цвітіння льону. У більш пізній період він може заразити рослину лише за наявності механічних пошкоджень або в місцях уколів комахами. Аскохітоз знижує енергію проростання і схожість насіння, призводить до зрідження посівів і зниження якості волокна. Збудник хвороби утворює на стеблах дрібні чорні випуклі точки - пікніди (вмістилища спор), які добре помітні на зів'ялих молодих рослинах серед бурих студенисто-прозорих ділянок уражених стебел. Надалі уражені ділянки висихають, знебарвлюються і чорні пікніди на них виступають ще різкіше. Кора стебла руйнується: луб'яні волокна обриваються, розтріскуються (розмочалюються), і рослина гине. Хвороба зі стебел переходить на коробочки і насіння, останні втрачають схожість. Джерело зараження: хвороба поширюється головним чином з насінням, а також із залишками врожаю на полях, стіжках, на місцях скирдування і обмолоту. У період вегетації рослин джерелом зараження посівів льону є спори-гриба, які переносяться з хворих на здорові рослини вітром, комахами, краплями дощу і роси.","Symptoms of the Disease

The disease manifests on stems and capsules as transparent brown, slightly sunken spots without sharp outlines. Over time, brown dots called pycnidia appear in the spots. Initially, they are covered by the epidermis, but become exposed after its destruction. Often, the brown spots expand and encompass the entire stem. If the root collar is affected, the plant dies. High soil and air humidity promote plant infection and disease development. The fungus typically penetrates the plant stem before the flax flowering stage. At a later stage, it can only infect the plant if there are mechanical damages or insect punctures.

Ascochyta blight reduces seed germination energy and viability, leading to thinning of crops and a decrease in fiber quality. The disease pathogen forms small black protruding dots on the stems, known as pycnidia (spore containers), which are clearly visible on wilted young plants among the brown gelatinous-transparent areas of the affected stems. Subsequently, the affected areas dry out, become discolored, and the black pycnidia stand out even more prominently. The stem bark is destroyed: bast fibers break, crack (become frayed), and the plant dies. The disease spreads from the stems to the capsules and seeds, with the latter losing their viability.

Source of Infection:

The disease primarily spreads through seeds, as well as crop residues in fields, threshing floors, and storage sites. During the plant's growing season, the source of flax crop infection is the fungal spores, which are transferred from diseased to healthy plants by wind, insects, raindrops, and dew.","Факторы, содействующие развитию болезниЗараженность аскохитозом возрастает при влажной погоде, особенно на поздних посевах, при их повышенной засоренности, недостаточной удобренности почвы минеральными удобрениями и других неблагоприятных условиях роста льна.","Фактори, що сприяють розвитку хвороби. Ураженість аскохітозом зростає за вологої погоди, особливо на пізніх посівах, при їх підвищеній засміченості, недостатньому удобренні ґрунту мінеральними добривами та інших несприятливих умовах росту льону.","Factors Contributing to Disease Development

The incidence of ascochyta blight increases in wet weather, particularly in late sowings, when there is increased weed infestation, insufficient soil fertilization with mineral fertilizers, and other unfavorable growing conditions for flax.",,,,,https://betaren.ru/harmful/bolezni/bolezni-lna/askohitoz/,лен
