id,name,name_en,scientific_name,is_active,description_ru,description_ua,description_en,symptoms_ru,symptoms_ua,symptoms_en,development_conditions_ru,development_conditions_ua,development_conditions_en,control_measures_ru,control_measures_ua,control_measures_en,photo_path,source_urls,crops
27e5cfe6-81ae-4e41-bb38-06790c7a9cd1,Полиспороз льна,Polyspora of flax,,True,"Полиспороз (побурениеили ломкость стеблей, бурая пятнистость, бурая присуха)Возбудитель -грибPolispora lini Laff et Peth","Поліспороз (побуріння або ламкість стебел, бура плямистість, бура присуха) Збудник - гриб Polispora lini Laff et Peth","Polisporosis (stem browning or brittleness, brown spot, brown blight) Causative agent - the fungus Polispora lini Laff et Peth","Симптомы болезниНа семядолях, нижних листьях и у корневой шейки молодых растений появляются сначала бурые пятна, а затем ткань в этих местах разрушается и образуются язвы в виде раковин или бурых перетяжек вокруг стебля.Пораженные стебли переламываются, и растения почти всегда погибают.В период цветения и уборки льна болезнь проявляется на стеблях и коробочках в виде буро-коричневых шероховатых, а иногда слегка вдавленных, с темной каймой, резко ограниченных пятен, которые часто сливаются и приобретают темно-бурую окраску. Ткани коры в этих местах разрушаются и сжимаются, как бы присыхая к волокнам, вследствие чего болезнь часто называют «бурой присухой». Хрупкость стенок волокон приводит к ломкости стеблей. Стебли падают на землю и погибают. В результате стеблестой изреживается и спутывается.Урожай и качество льнопродукции снижаются.Ко времени созревания льна все органы больного растения (листья, стебли, веточки метелки, коробочки) покрываются бурыми пятнами, на поверхности которых во влажную погоду образуется огромное количество спор гриба полиспоры.Во влажную погоду на пораженных тканях появляются едва заметные, слегка слизистые бесцветные или молочно-белые подушечки, являющиеся конидиальным спороношением гриба. С помощью конидий гриб распространяется в период вегетации растений.В пораженных растениях грибница распространяется в эпидермисе. Лубяные волокна и древесина не поражаются, но их стенки утончаются. В семенах гриб часто находится в наружной оболочке в виде гиф, но иногда они проникают в зародыш. В сухих семенах патоген сохраняется до двух с половиной лет, а на растительных остатках - два-три года.Бурая присуха на волокне вызывается тем, что процесс разрушения пектина при мочке и расстиле льняной соломы на месте бурых пятен замедляется, коровые ткани и костра трудно отделяются. В результате повышается закостренность и снижаются прядильные свойства волокна. Длинное волокно теряет крепость.Источник инфекции:семена, растительные остатки.","Симптоми хвороби. На сім'ядолях, нижніх листках і біля кореневої шийки молодих рослин спочатку з'являються бурі плями, а потім тканина в цих місцях руйнується і утворюються виразки у вигляді раковин або бурих перетяжок навколо стебла. Уражені стебла переламуються, і рослини майже завжди гинуть. У період цвітіння та збирання льону хвороба проявляється на стеблах і коробочках у вигляді буро-коричневих шорстких, а іноді злегка вдавлених, з темною облямівкою, різко обмежених плям, які часто зливаються і набувають темно-бурого забарвлення. Тканини кори в цих місцях руйнуються і стискаються, ніби присихаючи до волокон, через що хворобу часто називають «бурою присухою». Крихкість стінок волокон призводить до ламкості стебел. Стебла падають на землю і гинуть. У результаті стеблостій зріджується і заплутується. Урожай і якість льонопродукції знижуються. До часу дозрівання льону всі органи хворої рослини (листя, стебла, гілочки мітелки, коробочки) покриваються бурими плямами, на поверхні яких у вологу погоду утворюється велика кількість спор гриба полісфори. У вологу погоду на уражених тканинах з'являються ледь помітні, злегка слизові безбарвні або молочно-білі подушечки, які є конідіальним спороношенням гриба. За допомогою конідій гриб поширюється в період вегетації рослин. У уражених рослинах грибниця поширюється в епідермісі. Луб'яні волокна і деревина не уражаються, але їх стінки стоншуються. У насінні гриб часто знаходиться в зовнішній оболонці у вигляді гіф, але іноді вони проникають у зародок. У сухому насінні патоген зберігається до двох з половиною років, а на рослинних рештках - два-три роки. Бура присуха на волокні викликається тим, що процес руйнування пектину при мочці і розстилі льонової соломи на місці бурих плям сповільнюється, корові тканини і костра важко відокремлюються. У результаті підвищується закостреність і знижуються прядильні властивості волокна. Довге волокно втрачає міцність. Джерело інфекції: насіння, рослинні рештки.","Symptoms of the Disease

Initially, brown spots appear on the cotyledons, lower leaves, and at the root collar of young plants. Subsequently, the tissue in these areas deteriorates, forming ulcers in the form of cankers or brown constrictions around the stem. Affected stems break, and the plants almost always die. During the flowering and harvesting period of flax, the disease manifests on the stems and capsules as rough, brownish spots, sometimes slightly depressed, with a dark border, sharply defined. These spots often merge and take on a dark brown color. The bark tissues in these areas deteriorate and shrink, as if adhering to the fibers, which is why the disease is often referred to as ""brown shrink."" The brittleness of the fiber walls leads to stem fragility. The stems fall to the ground and perish, resulting in a thinned and tangled stand. The yield and quality of flax products decrease. By the time flax matures, all organs of the diseased plant (leaves, stems, panicle branches, capsules) are covered with brown spots, on the surface of which, in wet weather, a large number of polyspore fungus spores form. In wet weather, barely noticeable, slightly slimy, colorless or milky-white pustules appear on the affected tissues, which are the conidial sporulation of the fungus. The fungus spreads through conidia during the plant's growing season. In affected plants, the mycelium spreads in the epidermis. Bast fibers and wood are not affected, but their walls become thinner. In seeds, the fungus is often found in the outer shell in the form of hyphae, but sometimes they penetrate the embryo. In dry seeds, the pathogen can survive for up to two and a half years, and on plant residues for two to three years. Brown shrink on fiber is caused by the slowed-down process of pectin degradation during retting and spreading of flax straw at the site of brown spots, making it difficult to separate the bark tissues and shives. As a result, the shive content increases, and the spinning properties of the fiber decrease. Long fibers lose strength. 

Source of Infection: seeds, plant residues.",,,,,,,,https://betaren.ru/harmful/bolezni/bolezni-lna/polisporoz/,лен
f388cb23-bbfd-4f1a-a6cd-051054db2a2e,Ржавчина льна,Flax rust,однодомный базидиальный гриб,True,Возбудитель - однодомный базидиальный грибMelampsora lini Desm,Збудник - однодомний базидіальний гриб Melampsora lini Desm.,"The pathogen is a monoecious basidiomycete fungus, Melampsora lini Desm.","Симптомы болезниПоражаются листья, стебли и коробочки, при этом заболевание проявляется в трех формах:ранней весной на всходах (подсемядольном колене), семядолях, стебельке и молодых настоящих листочках обнаруживаются в небольших количествах желтовато-коричневые пятнышки и лимонно-желтые пустулы;в период бутонизации и цветения на листьях, стеблях и чашелистиках появляются мелкие, выпуклые ржаво-оранжевые пустулы;после цветения и старения тканей на стеблях, плодоножках и коробочках под эпидермисом образуются продолговатые, плотные, черные с глянцевым оттенком блестящие коростинки.","Симптоми хвороби Уражаються листя, стебла та коробочки, при цьому захворювання проявляється у трьох формах: ранньою весною на сходах (підсім'ядольному коліні), сім'ядолях, стебельці та молодих справжніх листочках виявляються в невеликих кількостях жовтувато-коричневі плямки та лимонно-жовті пустули; у період бутонізації та цвітіння на листках, стеблах і чашолистках з'являються дрібні, випуклі іржаво-оранжеві пустули; після цвітіння та старіння тканин на стеблах, плодоніжках і коробочках під епідермісом утворюються подовжені, щільні, чорні з глянцевим відтінком блискучі коростинки.","Symptoms of the Disease

The disease affects leaves, stems, and capsules, manifesting in three forms:

1. In early spring, on seedlings (hypocotyl), cotyledons, stems, and young true leaves, small yellowish-brown spots and lemon-yellow pustules are observed in limited quantities.

2. During the budding and flowering period, small, raised rust-orange pustules appear on leaves, stems, and sepals.

3. After flowering and tissue aging, elongated, dense, black, glossy scabs form under the epidermis on stems, peduncles, and capsules.",,,,,,,downloads\images/diseases\disease_Ржавчина_льна_f388cb23-bbfd-4f1a-a6cd-051054db2a2e.jpg,https://betaren.ru/harmful/bolezni/bolezni-lna/rzavchina_lna/,лен
2b1a3042-a371-4d49-93b9-f8a47f7d5ef5,Фузариоз льна,Fusarium Wilt of Flax,,True,Возбудители -Fusarium spp.,Збудники - Fusarium spp.,Pathogens - Fusarium spp.,,,,,,,,,,downloads\images/diseases\disease_Фузариоз_льна_2b1a3042-a371-4d49-93b9-f8a47f7d5ef5.jpg,https://betaren.ru/harmful/bolezni/bolezni-lna/fusarioz_lna/,лен
