id,name,name_en,scientific_name,is_active,description_ru,description_ua,description_en,symptoms_ru,symptoms_ua,symptoms_en,development_conditions_ru,development_conditions_ua,development_conditions_en,control_measures_ru,control_measures_ua,control_measures_en,photo_path,source_urls,crops
1bdee465-5985-4716-a1af-7bf462877f24,Пурпурный церкоспороз сои,Purple Cercospora of Soybean,гриб,True,Возбудитель - грибCercospora kikuchii,Збудник - гриб Cercospora kikuchii,Pathogen - the fungus Cercospora kikuchii,"Симптомы болезниПоражает сою во все фазы и проявляется на листьях, стеблях, бобах и семенах. Инфекция распространяется только в семенной оболочке. При прорастании больных семян, которые отличаются окраской от слабо-розовой до пурпурно-черной, семядольные листочки становятся темно-пурпурными и опадают. На стебле появляются охватывающие темно-пурпурные некротические пятна. На листьях пятна красновато-коричневые от мелких до крупных (1 см в диаметре). На бобах пятна вдавленные, красно-пурпурные, овальные или угловатые, до 2 см. Больные растения часто погибают, иногда плодоносят, образуя больные семена. Гриб сохраняется в растительных остатках и семенах до двух лет и более.Ухудшает товарные и посевные качества семян.","Симптоми хвороби Вражає сою на всіх фазах розвитку та проявляється на листках, стеблах, бобах і насінні. Інфекція поширюється лише в насіннєвій оболонці. При проростанні уражених насінин, які відрізняються забарвленням від слабо-рожевого до пурпурно-чорного, сім'ядольні листочки стають темно-пурпуровими і опадають. На стеблі з'являються темно-пурпурові некротичні плями, що охоплюють його. На листках плями червонувато-коричневі, від дрібних до великих (1 см у діаметрі). На бобах плями вдавлені, червоно-пурпурові, овальні або кутові, до 2 см. Уражені рослини часто гинуть, іноді плодоносять, утворюючи уражене насіння. Гриб зберігається в рослинних рештках і насінні до двох років і більше. Погіршує товарні та посівні якості насіння.","Symptoms of the Disease

The disease affects soybeans at all growth stages and manifests on leaves, stems, pods, and seeds. The infection spreads only within the seed coat. When infected seeds, which vary in color from light pink to purplish-black, germinate, the cotyledonary leaves become dark purple and fall off. Dark purple necrotic spots appear on the stem. On the leaves, the spots are reddish-brown, ranging from small to large (up to 1 cm in diameter). On the pods, the spots are sunken, red-purple, oval, or angular, up to 2 cm. Infected plants often die, though sometimes they bear fruit, producing diseased seeds. The fungus persists in plant debris and seeds for up to two years or more, deteriorating the commercial and sowing quality of the seeds.",,,,,,,downloads\images/diseases\disease_Пурпурный_церкоспороз_сои_1bdee465-5985-4716-a1af-7bf462877f24.jpg,https://betaren.ru/harmful/bolezni/bolezni-soi/purpurni_tsercosporoz/,соя
1a767a4b-34ac-4477-8dd8-3969c578f30a,Септориоз или ржавая пятнистость,Septoria leaf spot or rust spot,гриб,True,Возбудитель - грибSeptoria glycines,Збудник - гриб Septoria glycines,Pathogen - the fungus Septoria glycines,,,,,,,,,,downloads\images/diseases\disease_Септориоз_или_ржавая_пятнистость_1a767a4b-34ac-4477-8dd8-3969c578f30a.jpg,https://betaren.ru/harmful/bolezni/bolezni-soi/septorios_soi/,соя
bba68038-0c3e-4e74-9648-498bd5adde26,Склеротиниоз (белая гниль) сои,Sclerotinia stem rot (white mold) of soybean,гриб,True,Возбудитель - грибSclerotinia sclerotiorum,Збудник - гриб Sclerotinia sclerotiorum,Pathogen - the fungus Sclerotinia sclerotiorum,"Симптомы болезниПовсеместно распространенное заболевание сои. Обнаруживается в конце цветения - начале бобообразования в виде светлых пятен, которые во влажную погоду превращаются в мокрую гниль, а в сухую - в трухлявую массу. Пятна становятся бурыми, покрываются белым плотным ватообразным налетом, на котором образуются черные крупные склероции разной формы и величины.Пораженные стебли надламываются, растения увядают. Створки пораженных бобов обесцвечиваются, становятся трухлявыми, покрываются белым налетом со склероциями, семена в них загнивают, пораженные бобы обычно опадают.Источник инфекции: зараженные семена и сохранившиеся в почве склероции.","Симптоми хвороби

Повсюдно поширене захворювання сої. Виявляється наприкінці цвітіння - на початку формування бобів у вигляді світлих плям, які у вологу погоду перетворюються на мокру гниль, а в суху - на трухляву масу. Плями стають бурими, покриваються білим щільним ватоподібним нальотом, на якому утворюються чорні великі склероції різної форми та величини. Уражені стебла надламуються, рослини в'януть. Стулки уражених бобів знебарвлюються, стають трухлявими, покриваються білим нальотом зі склероціями, насіння в них загниває, уражені боби зазвичай опадають. Джерело інфекції: заражене насіння та склероції, що збереглися в ґрунті.","Symptoms of the Disease

A widespread disease of soybeans. It is detected at the end of flowering and the beginning of pod formation as light spots, which in wet weather turn into wet rot, and in dry conditions become a decayed mass. The spots turn brown and are covered with a dense white cotton-like mycelium, on which large black sclerotia of various shapes and sizes form. Affected stems break, and plants wilt. The pods of affected beans become discolored, turn decayed, and are covered with a white mycelium with sclerotia; the seeds inside rot, and the affected pods usually fall off. Source of infection: infected seeds and sclerotia preserved in the soil.",,,,,,,downloads\images/diseases\disease_Склеротиниоз_(белая_гниль)_сои_bba68038-0c3e-4e74-9648-498bd5adde26.jpg,https://betaren.ru/harmful/bolezni/bolezni-soi/sklerotinioz/,соя
d4891c35-7df4-4f14-a44a-8c3427913efb,Фомопсис сои,Phomopsis of soybean,гриб,True,Возбудитель - грибDiaporthe phaseolorum,Збудник - гриб Diaporthe phaseolorum,Pathogen - the fungus Diaporthe phaseolorum,"Симптомы болезниБолезнь вызывает гниль семян, поражение семядолей, черешков, стеблей, листьев в виде бурых или красно-коричневых пятен. Пораженные растения отстают в росте. Проявляется заболевание вначале на черешках нижних листьев, чаще в фазе образования бобов. На листьях образуются бурые или красновато-коричневые пятна. Листья засыхают, но не опадают.Бобы сои при раннем поражении опадают или растрескиваются, семена в них морщинистые, плесневеют, теряют всхожесть и пищевые качества.На пораженных стеблях образуются буро-коричневые зоны, начиная со второго междоузлия и до половины побега.Возбудитель фомопсиса передается через семена, вызывая заражение проростков. Патоген может сохраняться также в растительных остатках в виде пикнид. Растения с механическими повреждениями более восприимчивы к заболеванию.Вредоносность заболевания заключается в уменьшении количества бобов, снижении массы семян и их всхожести. При сильном поражении сои содержание масла в семенах уменьшается на 2,5 %.","Симптоми хвороби Хвороба викликає гниль насіння, ураження сім'ядоль, черешків, стебел, листя у вигляді бурих або червоно-коричневих плям. Уражені рослини відстають у рості. Захворювання проявляється спочатку на черешках нижніх листків, частіше у фазі формування бобів. На листках утворюються бурі або червонувато-коричневі плями. Листя засихає, але не опадає. Боби сої при ранньому ураженні опадають або розтріскуються, насіння в них зморщене, пліснявіє, втрачає схожість і харчові якості. На уражених стеблах утворюються буро-коричневі зони, починаючи з другого міжвузля і до половини пагона. Збудник фомопсису передається через насіння, викликаючи зараження проростків. Патоген може зберігатися також у рослинних залишках у вигляді пікнід. Рослини з механічними пошкодженнями більш сприйнятливі до захворювання. Шкідливість захворювання полягає у зменшенні кількості бобів, зниженні маси насіння та їх схожості. При сильному ураженні сої вміст олії в насінні зменшується на 2,5 %.","Symptoms of the Disease

The disease causes seed rot and affects cotyledons, petioles, stems, and leaves, manifesting as brown or reddish-brown spots. Affected plants exhibit stunted growth. The disease initially appears on the petioles of the lower leaves, often during the pod formation stage. Brown or reddish-brown spots develop on the leaves. The leaves dry out but do not fall off. Soybean pods, when affected early, may drop or crack, with seeds inside becoming wrinkled, moldy, losing germination ability and nutritional quality. On affected stems, brownish zones form, starting from the second internode to halfway up the shoot.

The pathogen, Phomopsis, is transmitted through seeds, causing infection in seedlings. The pathogen can also persist in plant residues in the form of pycnidia. Plants with mechanical damage are more susceptible to the disease. The harmfulness of the disease lies in the reduction of pod quantity, seed mass, and germination. In cases of severe soybean infection, the oil content in seeds decreases by 2.5%.",,,,,,,downloads\images/diseases\disease_Фомопсис_сои_d4891c35-7df4-4f14-a44a-8c3427913efb.jpg,https://betaren.ru/harmful/bolezni/bolezni-soi/fomopsis-soi/,соя
b2f8568f-ebd5-415e-b560-794165a69155,Фузариозная корневая гниль сои,Fusarium root rot of soybean,,True,Возбудитель -грибыFusarium avenaceum Sacc. и F. culmorum Sac.,Збудник - гриби Fusarium avenaceum Sacc. та F. culmorum Sac.,The pathogen is the fungi Fusarium avenaceum Sacc. and F. culmorum Sacc.,"Симптомы болезниВерхушка поврежденного растения сникает, что чаще всего бывает в период бутонизации, цветения, образования бобов. Молодые бобы в первой фазе налива приобретают вид «ошпаренных» горячей водой, с водянистым зелено-фиолетовым оттенком. Больные растения легко выдергиваются из почвы, у основания стебля нередко можно обнаружить оранжево-розовый налет спороношений гриба. Поперечный разрез стебля позволяет видеть закупоренные проводящие пучки, приобретающие тот же оранжево-розовый оттенок. Поражаются и семена сои.","Симптоми хвороби Верхівка ураженої рослини в'яне, що найчастіше спостерігається в період бутонізації, цвітіння, утворення бобів. Молоді боби на першій фазі наливу набувають вигляду «ошпарених» гарячою водою, з водянистим зелено-фіолетовим відтінком. Хворі рослини легко висмикуються з ґрунту, біля основи стебла нерідко можна виявити оранжево-рожевий наліт спороношень гриба. Поперечний розріз стебла дозволяє побачити закупорені провідні пучки, які набувають того ж оранжево-рожевого відтінку. Уражаються і насіння сої.","Symptoms of the Disease

The apex of the affected plant wilts, which most commonly occurs during the budding, flowering, and pod formation stages. Young pods in the initial filling phase appear ""scalded"" by hot water, exhibiting a watery green-purple hue. Diseased plants are easily pulled from the soil, and an orange-pink spore coating of the fungus can often be found at the base of the stem. A cross-section of the stem reveals clogged vascular bundles, which take on the same orange-pink hue. Soybean seeds are also affected.","Факторы, содействующие развитию болезниВысокая температура и неустойчивый водный режим почвы во второй половине лета.Чередовании культур, способствующих накоплению инфекции в почве.","Фактори, що сприяють розвитку хворобиВисока температура та нестійкий водний режим ґрунту в другій половині літа.Чергування культур, що сприяють накопиченню інфекції в ґрунті.","Factors Contributing to Disease Development

High temperatures and unstable soil moisture conditions in the second half of summer. Crop rotation practices that promote the accumulation of infection in the soil.",Меры защитыПредпосевное внесение в почву фосфорно-калийных удобренийУборка всех послеуборочных остатков с последующей глубокой зяблевой вспашкойИспользование устойчивых сортовСевооборотПротравливание семян,Заходи захистуПередпосівне внесення в ґрунт фосфорно-калійних добривЗбирання всіх післяжнивних залишків з подальшою глибокою зяблевою оранкоюВикористання стійких сортівСівозмінаПротруювання насіння,"Protective Measures

- Pre-sowing application of phosphorus-potassium fertilizers into the soil
- Removal of all post-harvest residues followed by deep autumn plowing
- Use of resistant varieties
- Crop rotation
- Seed treatment",downloads\images/diseases\disease_Фузариозная_корневая_гниль_сои_b2f8568f-ebd5-415e-b560-794165a69155.jpg,https://betaren.ru/harmful/bolezni/bolezni-soi/fuzariozn_kornevaya_gnil_soi/,соя
